{
  "requestType": "GetMeasurementLocations",
  "payloadProfile": "Minimal",
  "maxItems": 25,
  "filters": {
    "measurementLocationUuid": "55555555-5555-4555-8555-555555555555",
    "siteUuid": "11111111-1111-4111-8111-111111111111",
    "segmentUuid": "22222222-2222-4222-8222-222222222222",
    "typeUuid": "33333333-3333-4333-8333-333333333333"
  }
}
