{
  "requestType": "GetAssets",
  "payloadProfile": "Full",
  "maxItems": 25,
  "filters": {
    "assetUuid": "44444444-4444-4444-8444-444444444444",
    "siteUuid": "11111111-1111-4111-8111-111111111111",
    "typeUuid": "33333333-3333-4333-8333-333333333333",
    "serialNumber": "DEMO-ASSET-001"
  }
}
